{"$schema":"https://json-schema.org/draft/2020-12/schema","$id":"https://lab.local/schemas/learning-application-report.schema.json","title":"Execution learning application report","type":"object","required":["schema_version","report_id","brief_id","sources_consulted","applicable_incidents","current_recurrence_determinations","preventive_controls_applied","plan_changes_within_scope","stops_or_escalations","new_candidate_incidents","private_chain_of_thought_recorded","claim_boundary"],"properties":{"schema_version":{"const":"1.0.0"},"report_id":{"type":"string","minLength":1},"brief_id":{"type":"string","minLength":1},"sources_consulted":{"type":"array","items":{"type":"string"},"uniqueItems":true},"applicable_incidents":{"type":"array","items":{"type":"string"},"uniqueItems":true},"current_recurrence_determinations":{"type":"array","items":{"type":"object","required":["incident_ref","determination","evidence_refs","decision_effect"],"properties":{"incident_ref":{"type":"string"},"determination":{"enum":["CONFIRMED_CURRENT_OCCURRENCE","NOT_REPRODUCED","NOT_APPLICABLE","INSUFFICIENT_EVIDENCE"]},"evidence_refs":{"type":"array","items":{"type":"string"}},"decision_effect":{"type":"string"}},"additionalProperties":false}},"preventive_controls_applied":{"type":"array","items":{"type":"string"},"uniqueItems":true},"plan_changes_within_scope":{"type":"array","items":{"type":"string"},"uniqueItems":true},"stops_or_escalations":{"type":"array","items":{"type":"string"},"uniqueItems":true},"new_candidate_incidents":{"type":"array","items":{"type":"string"},"uniqueItems":true},"private_chain_of_thought_recorded":{"const":false},"claim_boundary":{"type":"string","minLength":1}},"additionalProperties":false}
