{"schema_version":"1.0.0","report_id":"LEARNING-APPLICATION-REPORT-193","brief_id":"CHATGPT_TRANSVERSAL_EXECUTION_LEARNING_AND_PRODUCT_LEADERSHIP_READINESS_REMEDIATION_193_001","sources_consulted":["registry/errors.json","docs/ERRORS_TO_AVOID.md","schemas/brief.schema.json","schemas/error.schema.json","projects/lab/evidence/EVD-LAB-PL003-STAGED-UNIQUE-REPLAY-187.json","projects/lab/evidence/EVD-LAB-PL003-FRESH-RETEST-192.json","projects/lab/analyses/PL003_BOOTSTRAP_SIMULATION_FAILURE_ANALYSIS_001.json",".gitattributes"],"applicable_incidents":["AUTHORIZATION_187_PRE_REQUEST_READINESS_BLOCK","AUTHORIZATION_192_PRE_REQUEST_READINESS_BLOCK","PRODUCT_LEADERSHIP_RAW_BYTE_EOL_MISMATCH","MISSING_MANDATORY_BRIEF_LEARNING_CONTEXT","DISPERSED_INCIDENT_TRACEABILITY"],"current_recurrence_determinations":[{"incident_ref":"MISSING_MANDATORY_BRIEF_LEARNING_CONTEXT","determination":"CONFIRMED_CURRENT_OCCURRENCE","evidence_refs":["schemas/brief.schema.json","docs/MODEL_OPERATING_RULES.md"],"decision_effect":"IMPLEMENT_TRANSVERSAL_LEARNING_CONTEXT_AND_CODEX_DECISION_PROTOCOL"},{"incident_ref":"DISPERSED_INCIDENT_TRACEABILITY","determination":"CONFIRMED_CURRENT_OCCURRENCE","evidence_refs":["registry/errors.json","projects/lab/pending/PEND-LAB-048.json"],"decision_effect":"CREATE_PRODUCT_LEADERSHIP_INCIDENT_LEDGER_AND_READINESS_VIEW"},{"incident_ref":"PRODUCT_LEADERSHIP_RAW_BYTE_EOL_MISMATCH","determination":"CONFIRMED_CURRENT_OCCURRENCE","evidence_refs":[".gitattributes","projects/lab/evidence/EVD-LAB-PL003-FRESH-RETEST-192.json"],"decision_effect":"ADD_TARGETED_LF_RULE_BUT_KEEP_FRESH_WORKTREE_PROOF_NOT_RUN"},{"incident_ref":"CODEX_PREEXISTING_AUTHENTICATION_ABSENT","determination":"NOT_APPLICABLE","evidence_refs":["projects/lab/authorizations/AUTHORIZATION_LAB_TRANSVERSAL_EXECUTION_LEARNING_AND_PRODUCT_LEADERSHIP_READINESS_REMEDIATION_193.json"],"decision_effect":"DO_NOT_LOGIN_OR_PROBE_AUTHENTICATION_UNDER_AUTHORIZATION_193"}],"preventive_controls_applied":["EXECUTION-LEARNING-FEEDBACK-LOOP-001","CODEX-CONFIRMED-ERROR-DECISION-PROTOCOL-001","BRIEF_LEARNING_CONTEXT_SCHEMA","LEARNING_APPLICATION_REPORT_SCHEMA","PRODUCT_LEADERSHIP_INCIDENT_LEDGER","PRODUCT_LEADERSHIP_FAIL_CLOSED_READINESS_VIEW","TARGETED_GITATTRIBUTES_LF_POLICY"],"plan_changes_within_scope":["SEPARATE_DOCUMENTARY_AND_CONFIGURATION_REMEDIATION_FROM_LOCAL_READINESS_PROBE","SEPARATE_LOCAL_READINESS_PROBE_FROM_FUTURE_MODEL_AUTHORIZED_RETEST","PRESERVE_LIVE_AUTHENTICATION_AND_RAW_BYTE_PROOF_AS_NOT_RUN","PRESERVE_LARGE_AGGREGATE_VIEW_DIVERGENCES_INSTEAD_OF_EXPANDING_SCOPE"],"stops_or_escalations":["FRESH_WINDOWS_WORKTREE_PROOF_REQUIRES_SEPARATE_AUTHORIZATION","CODEX_LOGIN_STATUS_REQUIRES_SEPARATE_AUTHORIZATION","FRESH_RETEST_REISSUE_REQUIRES_READINESS_PASS_AND_SEPARATE_AUTHORIZATION"],"new_candidate_incidents":["ERR-LAB-013"],"private_chain_of_thought_recorded":false,"claim_boundary":"STATIC_LEARNING_AND_CONFIGURATION_REMEDIATION_ONLY_NO_LIVE_READINESS_NO_MODEL_REQUEST_NO_INTEGRATION"}
